{
  "项目": {
    "名称": "",
    "类型": "web-fullstack | web-backend | web-frontend | cli | desktop | mobile | desktop-fullstack | executable | service | container | plugin | embedded/iot | library/sdk",
    "语言": "",
    "框架": "",
    "说明": "",
    "目录约定": "",
    "创建时间": "",
    "更新时间": ""
  },
  "运行形态": [],
  "功能树": [],
  "专业能力索引": [],
  "入口": {
    "用户入口": [],
    "接口入口": [],
    "命令入口": [],
    "事件入口": [],
    "系统入口": [],
    "资源入口": []
  },
  "模块拓扑": {
    "节点": [],
    "依赖图": []
  },
  "模块树": [],
  "模块详情": {},
  "页面拓扑": [],
  "数据拓扑": [],
  "交付物": [],
  "系统集成": [],
  "接口契约": {},
  "实现清单": {},
  "完整细节": {},
  "测试责任矩阵": [],
  "验证证据": {
    "自动化测试": [],
    "架构校验": [],
    "浏览器验收": [],
    "截图": [],
    "手动检查": [],
    "未验证项": []
  },
  "架构切片": {
    "启用": true,
    "架构模式": "架构文件夹",
    "总索引文件": "architecture/index.json",
    "根入口文件": "architecture.json",
    "切片目录": "architecture/",
    "切片清单": [],
    "同步规则": [
      "根 architecture.json 只作为轻量指针",
      "architecture/index.json 是当前项目真相源总索引",
      "所有切片必须位于 architecture/ 目录内"
    ]
  },
  "上下文恢复点": {
    "当前任务": "",
    "当前阶段": "",
    "继续位置": "",
    "最近完成": [],
    "下一步": [],
    "进行中模块": [],
    "已触碰文件": [],
    "已运行命令": [],
    "用户明确约束": [],
    "用户明确不要": [],
    "待确认问题": [],
    "未验证项": [],
    "剩余风险": [],
    "压缩摘要": "",
    "更新时间": ""
  },
  "未决问题": [],
  "变更记录": []
}
