{
  "项目": {
    "名称": "__待填__",
    "类型": "__待填：web-fullstack | web-backend | web-frontend | cli | desktop | mobile | desktop-fullstack | executable | service | container | plugin | embedded/iot | library/sdk__",
    "语言": "__待填__",
    "框架": "__待填__",
    "说明": "__待填__",
    "目录约定": "__待填__",
    "创建时间": "__自动生成__",
    "更新时间": "__自动生成__"
  },
  "运行形态": [
    "__待填：至少一个运行形态__"
  ],
  "功能树": [
    "__待填：功能树根节点__"
  ],
  "专业能力索引": [
    {
      "能力类型": "__待填：UI/测试/安全/性能/部署/文档等__"
    }
  ],
  "入口": {
    "用户入口": [
      "__待填：页面路由/CLI命令/桌面窗口等__"
    ],
    "接口入口": [
      "__待填：API端点/RPC方法等__"
    ],
    "命令入口": [
      "__待选填：CLI子命令树，无则置为空数组 []，保留键__"
    ],
    "事件入口": [
      "__待选填：WebSocket/消息队列等，无则置为空数组 []，保留键__"
    ],
    "系统入口": [
      "__待选填：定时任务/系统回调等，无则置为空数组 []，保留键__"
    ],
    "资源入口": [
      "__待选填：静态资源路由等，无则置为空数组 []，保留键__"
    ]
  },
  "模块拓扑": {
    "节点": [
      {
        "编号": "__待填__",
        "名称": "__待填：实现模块名称__"
      }
    ],
    "依赖图": [
      {
        "从": "__待填__",
        "到": "__待填__"
      }
    ]
  },
  "模块树": [
    {
      "编号": "__待填__",
      "名称": "__待填：模块名称__",
      "子模块": []
    }
  ],
  "模块详情": {
    "__示例模块名__": {
      "职责": "__待填：该模块负责什么__",
      "非职责": "__待填：该模块明确不负责什么__",
      "所属功能树节点": "__待填：关联到功能树的哪些节点__",
      "上游依赖": "__待填：依赖哪些模块__",
      "下游消费者": "__待填：被哪些模块使用__",
      "内部结构": "__待填：文件/类/函数结构__",
      "状态机": "__待填或标注：不适用__",
      "数据读写责任": "__待填：读写哪些数据__",
      "错误边界": "__待填：如何处理异常__",
      "配置": "__待填：需要哪些配置项__",
      "安全": "__待填：安全相关责任__",
      "日志审计": "__待填：日志记录策略__",
      "性能": "__待填：性能要求和优化点__",
      "测试责任": "__待填：需要哪些测试__"
    },
    "__注释__": {
      "说明": "每个实现模块必须有完整详情，删除本注释和示例后填写真实模块"
    }
  },
  "页面拓扑": [
    "__待选填：页面列表及关系，无页面则置为空数组 []，保留键__"
  ],
  "数据拓扑": [
    "__待填：数据实体/表/集合等__"
  ],
  "交付物": [
    "__待填：可部署产物/文档/配置等__"
  ],
  "系统集成": [
    "__待选填：外部系统/API/服务集成，无则删除本条，保留容器__"
  ],
  "接口契约": {
    "__示例接口名__": {
      "提供方": "__待填__",
      "消费方": "__待填__",
      "输入": "__待填__",
      "输出": "__待填__",
      "副作用": "__待填__",
      "错误码": "__待填__"
    },
    "__注释__": "每个跨模块接口必须有契约，删除本注释和示例后填写真实接口"
  },
  "实现清单": {
    "__示例模块名__": {
      "文件列表": [
        {
          "路径": "__待填：模块文件路径__"
        }
      ],
      "入口文件": "__待填__",
      "依赖模块": [
        "__待填__"
      ],
      "已完成": [
        "__待填：已实现的功能点__"
      ],
      "未完成": [
        "__待填：待实现的功能点__"
      ],
      "技术债": [
        "__待选填：已知的技术债务，无则删除本条，保留容器__"
      ]
    },
    "__注释__": {
      "说明": "每个实现模块必须有实现清单，删除本注释和示例后填写"
    }
  },
  "完整细节": {
    "__注释__": "此字段用于存放无法归类的补充信息，优先归类到其他字段"
  },
  "测试责任矩阵": [
    {
      "模块": "__待填__",
      "单元测试": "__待填：需要/不需要__",
      "集成测试": "__待填：需要/不需要__",
      "E2E测试": "__待填：需要/不需要__",
      "性能测试": "__待填：需要/不需要__",
      "安全测试": "__待填：需要/不需要__",
      "测试覆盖率目标": "__待填__"
    }
  ],
  "验证证据": {
    "自动化测试": [
      "__待填：测试运行结果__"
    ],
    "架构校验": [
      "__待填：validate_architecture.py 运行结果__"
    ],
    "浏览器验收": [
      "__待选填：手动测试结果，无则删除本条，保留容器__"
    ],
    "截图": [
      "__待选填：功能截图路径，无则删除本条，保留容器__"
    ],
    "手动检查": [
      "__待填：手动检查项和结果__"
    ],
    "未验证项": [
      "__待填：列出所有未验证的功能点和原因__"
    ]
  },
  "架构切片": {
    "启用": true,
    "架构模式": "架构文件夹",
    "总索引文件": "architecture/index.json",
    "根入口文件": "architecture.json",
    "切片目录": "architecture/",
    "切片清单": [
      "__待填：实际使用的切片文件列表__"
    ],
    "同步规则": [
      "根 architecture.json 只作为轻量指针",
      "architecture/index.json 是当前项目真相源总索引",
      "所有切片必须位于 architecture/ 目录内"
    ]
  },
  "上下文恢复点": {
    "当前任务": "__待填__",
    "当前阶段": "__待填：需求理解/骨架设计/模块详情/实现/验证__",
    "继续位置": "__待填__",
    "最近完成": [
      "__待填__"
    ],
    "下一步": [
      "__待填__"
    ],
    "进行中模块": [
      "__待填或标注：无__"
    ],
    "已触碰文件": [
      "__待填__"
    ],
    "已运行命令": [
      "__待填__"
    ],
    "用户明确约束": [
      "__待填或标注：无__"
    ],
    "用户明确不要": [
      "__待填或标注：无__"
    ],
    "待确认问题": [
      "__待填或标注：无__"
    ],
    "未验证项": [
      "__待填__"
    ],
    "剩余风险": [
      "__待填或标注：无__"
    ],
    "压缩摘要": "__待填：用一段话总结当前进度__",
    "更新时间": "__自动生成__"
  },
  "未决问题": [
    "__待填或标注：无__"
  ],
  "变更记录": [
    {
      "时间": "__自动生成__",
      "操作": "__待填：创建/修改/追加/校验__",
      "操作人": "__待填：Agent名称或用户__",
      "原因": "__待填__",
      "影响范围": "__待填__",
      "验证结果": "__待填__"
    }
  ]
}
